{
  "schemaVersion": "v0",
  "probeVersion": "0.1.0-mvp",
  "run": {
    "id": "r3",
    "mode": "differential",
    "startedAt": "2026-10-05T03:38:23.885608+00:00",
    "clusterIdentifier": "posture-probe-01 (throwaway, tockmox-policy 0.7.2)"
  },
  "namespaces": [
    {
      "name": "tockmox-ai",
      "podIP": "10.42.0.33",
      "identity": {
        "serviceAccount": "none",
        "tokenMounted": false,
        "apiServer": "no-token"
      },
      "exposure": {},
      "reachability": [
        {
          "endpoint": "posture-standin.tockmox-authentik.svc.cluster.local:8080",
          "ip": "10.43.246.114",
          "dstNamespace": "tockmox-authentik",
          "dimension": "ns-to-ns",
          "result": "refused",
          "observed": "denied",
          "latencyMs": 118
        },
        {
          "endpoint": "posture-standin.tockmox-devops.svc.cluster.local:8080",
          "ip": "10.43.230.7",
          "dstNamespace": "tockmox-devops",
          "dimension": "ns-to-ns",
          "result": "refused",
          "observed": "denied",
          "latencyMs": 112
        },
        {
          "endpoint": "posture-standin.tockmox-diagnostic.svc.cluster.local:8080",
          "ip": "10.43.183.141",
          "dstNamespace": "tockmox-diagnostic",
          "dimension": "ns-to-ns",
          "result": "refused",
          "observed": "denied",
          "latencyMs": 95
        },
        {
          "endpoint": "posture-standin.tockmox-monitoring.svc.cluster.local:8080",
          "ip": "10.43.129.50",
          "dstNamespace": "tockmox-monitoring",
          "dimension": "ns-to-ns",
          "result": "refused",
          "observed": "denied",
          "latencyMs": 73
        },
        {
          "endpoint": "posture-standin.tockmox-platform.svc.cluster.local:8080",
          "ip": "10.43.83.72",
          "dstNamespace": "tockmox-platform",
          "dimension": "ns-to-ns",
          "result": "refused",
          "observed": "denied",
          "latencyMs": 92
        },
        {
          "endpoint": "posture-standin.tockmox-selfcheck.svc.cluster.local:8080",
          "ip": "10.43.108.53",
          "dstNamespace": "tockmox-selfcheck",
          "dimension": "ns-to-ns",
          "result": "refused",
          "observed": "denied",
          "latencyMs": 183
        },
        {
          "endpoint": "1.1.1.1:443",
          "ip": "1.1.1.1",
          "dstNamespace": null,
          "dimension": "egress",
          "result": "refused",
          "observed": "denied",
          "latencyMs": 1002
        },
        {
          "endpoint": "10.43.0.1:443",
          "ip": "10.43.0.1",
          "dstNamespace": null,
          "dimension": "api-egress",
          "result": "refused",
          "observed": "denied",
          "latencyMs": 1024
        }
      ]
    },
    {
      "name": "tockmox-authentik",
      "podIP": "10.42.0.34",
      "identity": {
        "serviceAccount": "none",
        "tokenMounted": false,
        "apiServer": "no-token"
      },
      "exposure": {},
      "reachability": [
        {
          "endpoint": "posture-standin.tockmox-ai.svc.cluster.local:8080",
          "ip": "10.43.10.222",
          "dstNamespace": "tockmox-ai",
          "dimension": "ns-to-ns",
          "result": "refused",
          "observed": "denied",
          "latencyMs": 141
        },
        {
          "endpoint": "posture-standin.tockmox-devops.svc.cluster.local:8080",
          "ip": "10.43.230.7",
          "dstNamespace": "tockmox-devops",
          "dimension": "ns-to-ns",
          "result": "refused",
          "observed": "denied",
          "latencyMs": 43
        },
        {
          "endpoint": "posture-standin.tockmox-diagnostic.svc.cluster.local:8080",
          "ip": "10.43.183.141",
          "dstNamespace": "tockmox-diagnostic",
          "dimension": "ns-to-ns",
          "result": "refused",
          "observed": "denied",
          "latencyMs": 128
        },
        {
          "endpoint": "posture-standin.tockmox-monitoring.svc.cluster.local:8080",
          "ip": "10.43.129.50",
          "dstNamespace": "tockmox-monitoring",
          "dimension": "ns-to-ns",
          "result": "refused",
          "observed": "denied",
          "latencyMs": 185
        },
        {
          "endpoint": "posture-standin.tockmox-platform.svc.cluster.local:8080",
          "ip": "10.43.83.72",
          "dstNamespace": "tockmox-platform",
          "dimension": "ns-to-ns",
          "result": "refused",
          "observed": "denied",
          "latencyMs": 0
        },
        {
          "endpoint": "posture-standin.tockmox-selfcheck.svc.cluster.local:8080",
          "ip": "10.43.108.53",
          "dstNamespace": "tockmox-selfcheck",
          "dimension": "ns-to-ns",
          "result": "refused",
          "observed": "denied",
          "latencyMs": 311
        },
        {
          "endpoint": "1.1.1.1:443",
          "ip": "1.1.1.1",
          "dstNamespace": null,
          "dimension": "egress",
          "result": "open",
          "observed": "allowed",
          "latencyMs": 11
        },
        {
          "endpoint": "10.43.0.1:443",
          "ip": "10.43.0.1",
          "dstNamespace": null,
          "dimension": "api-egress",
          "result": "open",
          "observed": "allowed",
          "latencyMs": 0
        }
      ]
    },
    {
      "name": "tockmox-devops",
      "podIP": "10.42.0.35",
      "identity": {
        "serviceAccount": "none",
        "tokenMounted": false,
        "apiServer": "no-token"
      },
      "exposure": {},
      "reachability": [
        {
          "endpoint": "posture-standin.tockmox-ai.svc.cluster.local:8080",
          "ip": "10.43.10.222",
          "dstNamespace": "tockmox-ai",
          "dimension": "ns-to-ns",
          "result": "refused",
          "observed": "denied",
          "latencyMs": 11
        },
        {
          "endpoint": "posture-standin.tockmox-authentik.svc.cluster.local:8080",
          "ip": "10.43.246.114",
          "dstNamespace": "tockmox-authentik",
          "dimension": "ns-to-ns",
          "result": "refused",
          "observed": "denied",
          "latencyMs": 0
        },
        {
          "endpoint": "posture-standin.tockmox-diagnostic.svc.cluster.local:8080",
          "ip": "10.43.183.141",
          "dstNamespace": "tockmox-diagnostic",
          "dimension": "ns-to-ns",
          "result": "refused",
          "observed": "denied",
          "latencyMs": 154
        },
        {
          "endpoint": "posture-standin.tockmox-monitoring.svc.cluster.local:8080",
          "ip": "10.43.129.50",
          "dstNamespace": "tockmox-monitoring",
          "dimension": "ns-to-ns",
          "result": "refused",
          "observed": "denied",
          "latencyMs": 10
        },
        {
          "endpoint": "posture-standin.tockmox-platform.svc.cluster.local:8080",
          "ip": "10.43.83.72",
          "dstNamespace": "tockmox-platform",
          "dimension": "ns-to-ns",
          "result": "refused",
          "observed": "denied",
          "latencyMs": 171
        },
        {
          "endpoint": "posture-standin.tockmox-selfcheck.svc.cluster.local:8080",
          "ip": "10.43.108.53",
          "dstNamespace": "tockmox-selfcheck",
          "dimension": "ns-to-ns",
          "result": "refused",
          "observed": "denied",
          "latencyMs": 1
        },
        {
          "endpoint": "1.1.1.1:443",
          "ip": "1.1.1.1",
          "dstNamespace": null,
          "dimension": "egress",
          "result": "open",
          "observed": "allowed",
          "latencyMs": 10
        },
        {
          "endpoint": "10.43.0.1:443",
          "ip": "10.43.0.1",
          "dstNamespace": null,
          "dimension": "api-egress",
          "result": "open",
          "observed": "allowed",
          "latencyMs": 0
        }
      ]
    },
    {
      "name": "tockmox-diagnostic",
      "podIP": "10.42.0.36",
      "identity": {
        "serviceAccount": "none",
        "tokenMounted": false,
        "apiServer": "no-token"
      },
      "exposure": {},
      "reachability": [
        {
          "endpoint": "posture-standin.tockmox-ai.svc.cluster.local:8080",
          "ip": "10.43.10.222",
          "dstNamespace": "tockmox-ai",
          "dimension": "ns-to-ns",
          "result": "refused",
          "observed": "denied",
          "latencyMs": 23
        },
        {
          "endpoint": "posture-standin.tockmox-authentik.svc.cluster.local:8080",
          "ip": "10.43.246.114",
          "dstNamespace": "tockmox-authentik",
          "dimension": "ns-to-ns",
          "result": "refused",
          "observed": "denied",
          "latencyMs": 1
        },
        {
          "endpoint": "posture-standin.tockmox-devops.svc.cluster.local:8080",
          "ip": "10.43.230.7",
          "dstNamespace": "tockmox-devops",
          "dimension": "ns-to-ns",
          "result": "refused",
          "observed": "denied",
          "latencyMs": 1
        },
        {
          "endpoint": "posture-standin.tockmox-monitoring.svc.cluster.local:8080",
          "ip": "10.43.129.50",
          "dstNamespace": "tockmox-monitoring",
          "dimension": "ns-to-ns",
          "result": "refused",
          "observed": "denied",
          "latencyMs": 70
        },
        {
          "endpoint": "posture-standin.tockmox-platform.svc.cluster.local:8080",
          "ip": "10.43.83.72",
          "dstNamespace": "tockmox-platform",
          "dimension": "ns-to-ns",
          "result": "refused",
          "observed": "denied",
          "latencyMs": 150
        },
        {
          "endpoint": "posture-standin.tockmox-selfcheck.svc.cluster.local:8080",
          "ip": "10.43.108.53",
          "dstNamespace": "tockmox-selfcheck",
          "dimension": "ns-to-ns",
          "result": "refused",
          "observed": "denied",